"Template[Asset Reference]","AttributeValue[String]","FlavorText[String]"
"212F73E207CE0784","ancient","Inside an ancient wooden fireplace"
"81D3C7A270EE1A40","brimestone marble","Inside a fireplace made of brimstone marble"
"EF37870F966C296F","common iron","Inside a fireplace made of common iron"
"CCC1BEA0973FF66E","fancy","Inside lies a Conjurers fireplace"
"433CE8E83227136A","grand tavern replica","Inside lies a Grand Tavern replica fireplace"
"BC857B2D80268B7D","black marble","Inside a fireplace made of shadow black marble"
"4336A077A8F592F6","common",""